query,split,raw_gold-text,num_gold_texts,num_retrieved,retrieved_docs,text_recall,text_precision,text_f1,num_gold_texts_matched,ctx_precision,ctx_recall,ctx_f1,chunk_overlap,min_chunk_overlap,max_chunk_overlap,chunk_overlap_count,bleu,text_supported@1,text_recall@1,text_supported@3,text_recall@3
Explain the importance of ImageNet in the works alexnet and googlenet.,multi,"('We trained a large, deep convolutional neural network to classify the 1.2 million high-resolution images in the ImageNet LSVRC-2010 contest into the 1000 dif- ferent classes.', 'We propose a deep convolutional neural network architecture codenamed Incep- tion, which was responsible for setting the new state of the art for classiﬁcation and detection in the ImageNet Large-Scale Visual Recognition Challenge 2014 (ILSVRC14).')",2,6,"['as belonging to the class indicated by the image label. E ImageNet ImageNet is a dataset of millions of labeled images in thousands of categories. The images\nwere collected from the web and labelled by human labellers using Amazon’s Mechanical Turk\ncrowd-sourcing tool.', 'instance of a CIFAR-10 class, and that the object in the image be easily identiﬁable as belonging to the class indicated by the image label. E ImageNet\nImageNet is a dataset of millions of labeled images in thousands of categories.', '5 GoogLeNet We chose GoogLeNet as our team-name in the ILSVRC14 competition. This name is an homage to Yann LeCuns pioneering LeNet 5 network [10]. We also use GoogLeNet to refer to the particular\nincarnation of the Inception architecture used in our submission for the competition.', 'and bigger datasets to become available. 2 The Dataset ImageNet is a dataset of over 15 million labeled high-resolution images belonging to roughly 22,000 categories. The images were collected from the web and labeled by human labelers using Ama-\nzon’s Mechanical Turk crowd-sourcing tool.', 'of ten. Another difference is that the ImageNet images often contain multiple instances of ImageNet objects, simply due to the sheer number of object classes. For this reason, even a human would have difﬁculty approaching perfect accuracy on\nthis dataset.', 'layers and millions of parameters on the ImageNet dataset with 1 million training images. Since then, even larger and deeper networks have been trained [12]. The typical use of convolutional networks is on classi\x0ccation tasks, where\nthe output to an image is a single class label.', 'have ob- served consistent phenomena. To provide instances for dis- cussion, we describe two models for ImageNet as follows. Plain Network. Our plain baselines (Fig. 3, middle) are\nmainly inspired by the philosophy of VGG nets [41] (Fig. 3,\nleft).', 'image recognition (LeCun et al., 1998; Krizhevsky et al., 2012) and machine translation (Sutskever et al., 2014; Bahdanau et al., 2015; Wu et al., 2016). Along with this success is a paradigm shift from feature designing to architecture\ndesigning, i.e., from SIFT (Lowe, 1999), and HOG (Dalal & Triggs, 2005), to AlexNet (Krizhevsky\net al., 2012), VGGNet (Simonyan & Zisserman, 2014), GoogleNet (Szegedy et al., 2015), and\nResNet (He et al., 2016a).', 'networks with non-Inception architecture, however this requires careful manual design at this point. 5 GoogLeNet We chose GoogLeNet as our team-name in the ILSVRC14 competition. This name is an homage to\nYann LeCuns pioneering LeNet 5 network [10].', '2014. [13] K. He, X. Zhang, S. Ren, and J. Sun. Delving deep into rectiﬁers: Surpassing human-level performance on imagenet classiﬁcation. In ICCV , 2015. [14] G. E. Hinton, N. Srivastava, A. Krizhevsky, I. Sutskever, and\nR. R. Salakhutdinov.']",0.5,0.0,0.0,1,0.022727272727272728,0.5,0.04347826086956522,0.2635209838202437,0.2026726057906459,0.31141868512110726,10,2.8146288157849127e-07,0.0,0.0,0.0,0.0
How does auto-differentiation work in these frameworks?,single,"TensorFlow is an interface for expressing machine learning algorithms and an implementation for executing such algorithms •PyTorch  is a programming framework for tensor computation, deep learning, and auto differentiation 6Deep Learning Programming Framework7Aspect PyTorch TensorFlow JAX NumPy Primary Use Deep learning Deep learning numerical and ML computing numerical computing Programming Paradigm Dynamic (eager execution)Static (Graph mode, or Eager)Functional transformations Procedural Auto grad dynamic comp graphstatic comp graph Functional -based with grad/jit",1,5,"[', vol. abs/2106.05974, 2021. [Online]. Available: https://arxiv.org/abs/2106.05974 [23] N. Shazeer, Y . Cheng, N. Parmar, D. Tran, A. V . et al B. A. Hechtman. [24] A. Paszke, S. Gross, S. Chintala, G. Chanan, E. Yang, Z. DeVito, Z. Lin,\nA. Desmaison, L. Antiga, and A. Lerer, “Automatic Differentiation in\nPyTorch,” 2017.', 'Computation , In Press, 2018. Atilim Gunes Baydin, Barak A Pearlmutter, Alexey Andreyevich Radul, and Jeffrey Mark Siskind. Automatic differentiation in machine learning: a survey. Journal of machine learning research , 18\n(153):1–153, 2018.', 'Paszke, Sam Gross, Soumith Chintala, Gregory Chanan, Edward Yang, Zachary DeVito, Zeming Lin, Alban Desmaison, Luca Antiga, and Adam Lerer. Automatic differentiation in pytorch. 2017. [23] Noam Shazeer, Youlong Cheng, Niki Parmar, Dustin Tran, Ashish Vaswani, Penporn Koanan-\ntakool, Peter Hawkins, HyoukJoong Lee, Mingsheng Hong, Cliff Young, et al.', ', 2017. Dougal Maclaurin, David Duvenaud, and Ryan P Adams. Autograd: Reverse-mode differentiation of native Python. In ICML workshop on Automatic Machine Learning , 2015. Hongyuan Mei and Jason M Eisner.', 'autograd requires implementing a new Function subclass for each operation. Recall that Functions are what autograd uses to encode the operation history and compute gradients. The first part of this doc is focused on backward mode AD as it is the most widely used feature.', 'A Pearlmutter, Alexey Andreyevich Radul, and Jeffrey Mark Siskind. Automatic differentiation in machine learning: a survey. Journal of machine learning research , 18 (153):1–153, 2018. Rianne van den Berg, Leonard Hasenclever, Jakub M Tomczak, and Max Welling.', 'end of the iteration.) 2. Helps avoid certain reference cycles, (e.g., since the tensor output of the autograd.Function itself keeps a reference to the ctx). 3.', 'Pass (important for HW 1) 34Build the AutoDiff Graph 35Use AutoGrad •use finite differences to check our gradient calculations 𝜕𝑓(𝑥1,𝑥2) 𝜕𝑥1=𝑓𝑥1+ℎ,𝑥2−𝑓(𝑥1−ℎ,𝑥2) 2ℎ •Care the precision! oUse double precision (fp64)\noPick a small ℎ=0.000001\noCompute the forward difference through the graph twice\n36How to check the correctness of gradient•Learning parameters of an NN needs gradient calculation\n•Computation Graph\noto perform computation: topological traversal along the DAG\n•Auto Differentiation\nobuilding backward computation graph for gradient calculation\n•https:// github.com /mattjj /autodidact/\n37Summary•Auto Diff survey, https://arxiv.org/abs/1502.05767  \n•The Elements of Differentiable Programming (Book), \nhttps://arxiv.org /abs/2403.14606  \n38Additional Reading•TensorFlow: A System for Large -Scale Machine Learning, \nOSDI 2016.', 'and Ryan P Adams. Autograd: Reverse-mode differentiation of native Python. In ICML workshop on Automatic Machine Learning , 2015. Hongyuan Mei and Jason M Eisner. The neural Hawkes process: A neurally self-modulating\nmultivariate point process.', 'Hoffman, Marcus Brubaker, Daniel Lee, Peter Li, and Michael Betan- court. The Stan math library: Reverse-mode automatic differentiation in c++. arXiv preprint arXiv:1509.07164 , 2015. Bo Chang, Lili Meng, Eldad Haber, Lars Ruthotto, David Begert, and Elliot Holtham.']",0.0,0.0,0.0,0,0.08771929824561403,1.0,0.16129032258064516,0.2821541846699104,0.18944844124700239,0.48125,10,1.6035037765703961e-07,0.0,0.0,0.0,0.0
"What are FlashMLA, DeepEP, and DeepGEMM, and what problems do they each solve?",single,"Accelerating Transformer Layers•FlashMLA  (released 2/24/2025) FlashMLA  is an efficient MLA decoding kernel for Hopper GPUs, optimized for variable -length sequences serving. DeepEP  (released 2/25/2025) oa communication library tailored for Mixture -of-Experts ( MoE) and expert parallelism (EP). It provides high -throughput and low -latency all -to-all GPU kernels, which are also as known as MoE dispatch and combine. DeepGEMM  (released 2/26/2025) oDeepGEMM  is a library designed for clean and efficient FP8 General Matrix Multiplications (GEMMs) with fine -grained scaling 3Deepseek  opensource libraries",1,7,"['and expert parallelism (EP). It provides high -throughput and low -latency all -to-all GPU kernels, which are also as known as MoE dispatch and combine. •DeepGEMM  (released 2/26/2025)\noDeepGEMM  is a library designed for clean and efficient FP8 General Matrix \nMultiplications (GEMMs) with fine -grained scaling\n3Deepseek  opensource libraries\nhttps://github.com/deepseek -ai/ •Overview of large -scale model training\n•Multi -GPU communication\n•Data Parallel Training via AllReduce\n4OutlineTransformerGPT1GPT2GPT3GopherPALMGPT4\nNemotron\nLLaMA3 -8BLLaMA3.1\nQwen2DeepSeek -v3\n001101001,00010,000\n2016 2017 2018 2019 2020 2021 2022 2023 2024 2025size(B)\n5Scale of LLMs\n671B1.8TGPT1GPT2GPT3 GopherPALMGPT4 LLaMA3.1\nQwen2DeepSeek -v3\n01101001,00010,000100,000\n2017 2018 2019 2020 2021 2022 2023 2024 2025 2026Tokens (B)\n6Scale of Training Data\n15T•Pretraining for Deepseek  V3 (671B)\no2,048 H800 GPUs\notrained for 2 months\noa total of 2.664 million H800 GPU hours\n•LLaMA  3.1(405B) \nousing 16,000 H100 GPUs\noa total of 30.84 million GPU hours\n7Large -scale Distribution TrainingStrategies for Scalable Training\n8\nPartition the data\nsingle node \ndata parallel\ndistributed \ndata parallel\nparameter \nserver\nPartition the Model\nModel \nparallel\nPipeline \nparallel\nTensor \nparallel9Classical Distributed Training: Parameter Server\nData\nworker worker worker worker\nlocal grad local grad local grad local grad\npush (worker to server)partition\nParameter server\naggregate grads, update parameterspull\n1\n2\n3\n 3\n 3\n 3\n4\n5•Overview of large -scale model training\n•Multi -GPU communication\n•Data Parallel Training via AllReduce\n10Outline\n•NCCL (Nvidia Collective Communication Library)\noprovides inter -GPU communication APIs\noboth collective and point -to-point send/receive primitives\nosupports various of interconnect technologies\n•PCIe\n•NVLink\n•InfiniBand\n•IP sockets\noOperations are tied to a CUDA stream.', 'accommodated within the GPU memory. Compatibility with FlashAttention [ 10].FlashAttention is an attention backend widely used in modern LLM serving system to accelerate attention computation. It avoids writing attention weights\nto HBM through kernel fusion, thus significantly reducing data movement between on-chip memory\nand HBM.', '51,60]. To reduce the memory footprint, both methods avoid storing the large attention matrix in the forward pass and recompute it in the backward pass. The ﬁrst major diﬀerence is that Rabe and Staats [66]focuses on the reducing the total memory footprint\n(maximum amount of GPU memory required) while FlashAttention focuses on reducing memory accesses\n(the number of memory reads/writes).', 'FlashAttention be- haves the same as the baseline implementation and the validation perplexity curves of the two implementations almost lie on top of each other. Long Document Classiﬁcation.', 'FlashAttention ’s correctness, runtime, and memory requirement (proof in Appendix C). Theorem 1. Algorithm 1 returns O=softmax¹QK>ºVwith𝑂¹𝑁2𝑑ºFLOPs and requires 𝑂¹𝑁ºadditional memory beyond inputs and output. 3.2 Analysis: IO Complexity of FlashAttention\nWe analyze the IO complexity of FlashAttention , showing signiﬁcant reduction in HBM accesses compared\nto standard attention.', 'that FlashAttention has smaller total memory requirement compared to Rabe and Staats [66]. The ﬁnal major diﬀerence is the way the backward pass is computed. Rabe and Staats [66]uses gradient\ncheckpointing to recompute the attention matrix and the temporary output of each block.', '1. Within this process, FLEXINFER kernel achieves 1.01 ×of native FlashAttention performance and 1.23 ×of Paged FlashAt- tention performance, proving its robustness and computation flexibility. 7.2.2 Prefix-prefilling Kernel Evaluation\nOn the left of Figure 8, we evaluate different prefix-prefilling\nkernels with varied batch sizes.', 'However, it focuses specifically on prefetching and does not address other opti- mizations such as unsharding or offloading, which leads to notable differences in design. In SimpleFSDP, communica-\ntion operations are inserted into the user-level code (Python)\nbefore compilation, whereas DeepCompile first compiles the\nmodel into a computation graph and then applies transforma-\ntions.', 'Flashattention-2: Faster attention with better parallelism and work partitioning. CoRR , abs/2307.08691, 2023. doi: 10.48550/ARXIV .2307.08691. URL https://doi.org/10. 48550/arXiv.2307.08691 . Tri Dao, Daniel Y . Fu, Stefano Ermon, Atri Rudra, and Christopher Ré.', 'corpus composed of encyclopedia data, web data, ebook data, etc. For DPMoE, we perform all the experiments with our implementation based on Megatron-LM8v2.5 and DeepSpeed9v0.5.10. For PPMoE, we build our codebase upon the implementation of Megatron-\nLM v2.6.']",1.0,0.1,0.18181818181818182,1,0.06060606060606061,0.5,0.10810810810810813,0.2590757846707296,0.13846153846153847,0.4368421052631579,10,0.07490978803373669,0.0,1.0,0.0,1.0
What are the challenges of theoretical distributed training (PipeDream) and what is the scaling efficiency of distributed real-world Trainium performance (HLAT)?,multi,"('Challenge 1: Stage Partitioning•How to partition model layers into the stages evenly? •Throughput depends on the slowest stage in pipeline •Solution: •Proﬁle layer-wise perf and comm perf •Allows a stage to be replicated (DP) •Uses dynamic programming to ﬁnd optimal partition and layer replication', 'Challenge 2: Work Scheduling•How to schedule forward and backward computation on a worker? •Solution: 1F1B-RR •Run one forward and one backward •Round-robin across replicated stages', 'Challenge 3: Weight Versioning•How to ensure the same minibatch uses the same weight version across workers for forward and backward? •Otherwise computation will be far oﬀ and training not able to converge •Solution: Store multiple weight versions so that the backward and forward of the same minibatch •Weights across workers can be diﬀerent!', 'The scaling efficiency for Llama2 7b:•87% on 32 nodes. MFU = 33.5%•72% on 64 nodes. MFU = 27.9%© 2025, Amazon Web Services, Inc. or its affiliates. All rights reserved. Amazon Confidential and Trademark. Observations on training precision for 70B (preliminary)')",4,7,"['recent years for distributed LLM training, including model parallelism, data parallelism, and pipeline parallelism [ 31;27;19]. However, a single parallelism strategy has limitations regarding scalability. For example, the performance of data parallelism with\nZeRO-3 will decrease dramatically when the number of GPUs increases to several thousands [21].', 'assume that workloads remain stable dur- ing training. Consequently, they fail to handle the pipeline stalls introduced by dynamic models, leading to reduced computational efficiency. Innovative designs of dynamic models aim to reduce compu-\ntational cost, but without effective load balancing, their benefits\npractically fail to translate into actual performance gains during\ndistributed training [ 4].', '[cs.LG] 23 Apr 2025Training large-scale MoE models, however, presents significant challenges. As the model size increases, efficient distributed training across thousands of GPUs becomes essential. Different paral-\nlelism strategies have been proposed in recent years for distributed LLM training, including model\nparallelism, data parallelism, and pipeline parallelism [ 31;27;19].', 'reducing memory footprint in distributed training o➔ enables training significantly larger models •Key idea: partition optimizer states, gradients, and parameters. •Pros: oLower memory usages significantly. oScalable, flexible, easy -to-use.', 'Figure 10 shows the training losses for both settings. Although some operators are non-deterministic and introduce subtle differ- ences, the loss curves were closely aligned. 6 Related Work\n6.1 Distributed Training Framework\nAs discussed in Section 2, various distributed training strate-\ngies have been proposed to scale deep learning models be-\nyond the capacity of a single GPU.', 'Volume 2 . 1112–1127. [53] Xupeng Miao, Yining Shi, Zhi Yang, Bin Cui, and Zhihao Jia. 2023. SDPipe: A Semi-Decentralized Framework for Heterogeneity-aware Pipeline-parallel Training. Proc. VLDB Endow. 16 (2023).', 'bottlenecks by hori- zontally scaling CPU nodes and leveraging a coordinated read mechanism to mitigate straggler issues caused by input size variability in distributed training. Specifically, it is comprised\nof four key components: a dispatcher, a pool of workers,\nclients, and an orchestrator.', 'distributed training o➔ enables training significantly larger models •Key idea: partition optimizer states, gradients, and parameters. •Pros: oLower memory usages significantly. oScalable, flexible, easy -to-use. •Cons:\noSome stages introduce extra communication overhead, depending on \ninfrastructure (PCI -E / NVLink )\n75Summary•https://github.com/llmsystem/llmsys_code_examples/blob/m\nain/deepspeed_example/DeepSpeed -Example.ipynb  \n76Code Example', 'Distributed Training System. arXiv preprint arXiv:2203.14685 . Zheng, Z.; Yaqi, X.; Hulin, W.; Donglin, Y . ; Chuang, H.; Xiaobo, Z.; and Dazhao, C. 2024. MPMoE: Memory Effi-\ncient MoE for Pre-Trained Models With Adaptive Pipeline\nParallelism.', 'about future tokens [44]. Production distributed training frameworks typically apply static load balancing at the start of training and maintain the same distri- bution throughout. For example, Megatron-LM [ 50] evenly splits\ntransformer layers across accelerators.']",0.0,0.0,0.0,0,0.0,0.0,0.0,0.254194367612887,0.15848214285714285,0.35094339622641507,10,2.029116224770119e-07,0.0,0.0,0.0,0.0
What are the three core components of the TinyServe system?,single,"The system is organized around three core components: (1)Query-Aware KV Retriever: Dynamically selects relevant key-value blocks at decode time based on the current query vector and page-level metadata, reducing unnecessary mem- ory access. (2)Modular Scheduling Pipeline: A dispatch loop handles incoming queries and routes them through configurable plug- ins (e.g., entropy-based early exit, token-level pruning, ap- proximate attention). This modular design allows experimen- tation with different sparsity strategies without modifying the core model. (3)Sparse Attention Executor: Efficiently computes attention over selected KV pages using fused CUDA kernels, with support for FP16/INT8 KV formats and multi-GPU dispatch.",1,1,"['frameworks. 3 Methodology 3.1 System Overview: TinyServe TinyServe is a lightweight serving framework designed for serving tiny language models under tight memory and latency constraints. Rather than acting as a benchmarking tool, TinyServe serves as a\nreal-time serving environment that enables sparsity-aware atten-\ntion, modular token selection, and efficient KV-cache reuse.', 'than acting as a benchmarking tool, TinyServe serves as a real-time serving environment that enables sparsity-aware atten- tion, modular token selection, and efficient KV-cache reuse. The system is organized around three core components:\n(1)Query-Aware KV Retriever: Dynamically selects relevant\nkey-value blocks at decode time based on the current query\nvector and page-level metadata, reducing unnecessary mem-\nory access.', 'cache activation; - Memory-aware scheduling (e.g., prefetching selected pages); - Reduced HBM bandwidth pressure. System Implication. TinyServe enables dynamic query-aware sparsity without requiring architectural retraining. The modular\nimplementation integrates directly into TinyServe’s kernel loop\nand allows hardware-sensitive scheduling: e.g., keeping hot pages\nin shared memory or limiting K to match tensor core granularity.', '} KV load+𝜏attn(𝐾·𝑆) This structure-aware design ensures: - Query-dependent cache activation; - Memory-aware scheduling (e.g., prefetching selected pages); - Reduced HBM bandwidth pressure. System Implication. TinyServe enables dynamic query-aware\nsparsity without requiring architectural retraining.', 'models (e.g., 125M–350M parameters). TinyServe replicates core compo- nents of LLM serving—streaming decoding, KV cache management, token routing, and quantization—in a fully controllable environ- ment. Crucially, it supports fine-grained instrumentation and plug-\nin modules such as entropy-based early exit, query-aware KV se-\nlection, and approximate attention.', 'core model. (3)Sparse Attention Executor: Efficiently computes attention over selected KV pages using fused CUDA kernels, with support for FP16/INT8 KV formats and multi-GPU dispatch. In TinyServe, each decode step activates the TinyServe pipeline:\nthe query vector is used to score KV pages, top-ranked pages are\nfetched, sparse attention is performed, and plug-in modules may\ntrigger pruning or early stopping.', 'exhibits bursty memory loads. TinyServe shows smoother and significantly lower access patterns, re- maining well below the HBM threshold, benefiting from query-aware page-level KV selection. Vertical dotted lines\nmark key transitions in token reuse or decoding stages.', 'integrates directly into TinyServe’s kernel loop and allows hardware-sensitive scheduling: e.g., keeping hot pages in shared memory or limiting K to match tensor core granularity. The kernel design for TinyServe can be found at algorithm 1.', 'to two bot- tlenecks: •Memory movement : loading all𝑘𝑖,𝑣𝑖from high-bandwidth memory (HBM); •Unstructured access : attention requires full key scan with no cache prefetch pattern. To address this, TinyServe introduces a structured memory\nlayout via token grouping into fixed-size pages .', 'emphasize that carefully designed synthetic stressors and caching strategies are essential for both graph-based and language-based workloads, re- inforcing the importance of lightweight analysis frameworks. 3 Methodology\n3.1 System Overview: TinyServe\nTinyServe is a lightweight serving framework designed for serving\ntiny language models under tight memory and latency constraints.']",1.0,0.4,0.5714285714285715,1,0.1111111111111111,0.75,0.19354838709677416,0.34540838287094405,0.21577726218097448,0.5660377358490566,10,0.13238010034611578,0.0,0.0,0.3333333333333333,1.0
