query,split,raw_gold-text,num_gold_texts,num_retrieved,retrieved_docs,text_recall,text_precision,text_f1,num_gold_texts_matched,ctx_precision,ctx_recall,ctx_f1,chunk_overlap,min_chunk_overlap,max_chunk_overlap,chunk_overlap_count,bleu,text_supported@1,text_recall@1,text_supported@3,text_recall@3
What are the trade-offs between simple post-training quantization and GPTQ?,multi,"('8CUDA APIs for Half Precision•Using lower precision oconverting parameters from FP32 to INT8 or INT4 operform all computation in lower prevision. Reduce model accuracy: oLoss of Precision ➔ accumulate quantization noise oRange mismatch ➔ values are clipped and lead to information loss oQuantization error ➔ rounding errors 9Direct Quantization Approach•Absmax  quant Zero -point quant 10Quantize a number', 'mixed strategy for 8 -bit quantization and 16 -bit (for outliers)2Recap of Basic Quantization Methods•Absmax  quant Zero -point quant 4Quantize a Number to Int8 5GPTQ scale to GPT -size LLMs maintain accuracy•Revisit  layer -wise quantization of weight matrices argmin', 'layer -wise quantization + compensation for errors + precompute oaccurately compress some of the largest publicly -available models down to 3 and 4 bits, and bring end -to-end speedups')",3,3,"['training •Code Walkthrough 30Outline •GPTQ is Post -Training Quantization (PTQ): converting the weights of an already trained model to a lower precision without any retraining. •Quantization -Aware Training (QAT): integrates the weight \nconversion process during the training stage.', 'model to a lower precision without any retraining. •Quantization -Aware Training (QAT): integrates the weight conversion process during the training stage. often superior model performance. ( QLoRA ) \n31Quantization -Aware TrainingQLoRA = Low -rank + Quantized training\n●Major innovations:\n○4-bit Normal Float for storage\n○Double Quantization\n○Page Optimizer\n●BF16 for computation\n➔Reduces the average memory requirements of fine -tuning a 65B \nparameter model from 780GB of GPU memory to 48GB on a single \nGPU.', '-NeoX20B) •At 1.3B scale, computation time is ~3 hours obut slower than GPTQ (x100 larger in ~4 hours) •integrated in Deepspeed 22ZeroQuant Yao et al. ZeroQuant : Efficient and Affordable Post -Training Quantization for Large -Scale Transformers.', 'Round -to- nearest methods? •How does GPT -Q speed up model inference in practical applications? •Does GPT -Q even work for extreme 2 -bit quantization? 22Effectiveness of GPTQ?•Calibration data randomly sampled from C -4 dataset to \nensure GPTQ is not task -aware.', '•How is GPT -Q’s perf on large models compared with Round -to- nearest methods? •How does GPT -Q speed up model inference in practical applications? •Does GPT -Q even work for extreme 2 -bit quantization?', 'of an already trained model to a lower precision without any retraining. •Quantization -Aware Training (QAT): integrates the weight conversion process during the training stage. often superior \nmodel performance.', '3h Does GPT -Q even work for extreme 2 -bit quantization? 28 How is GPT -Q’s perf on small models compared with accurate -but-expensive methods? 29\n Fastest prior method•https://github.com/qwopqwop200/GPTQ -for-LLaMa/  \n•GPTQ in \nohttps://github.com/qwopqwop200/GPTQ -for-\nLLaMa/blob/triton/gptq.py  \n31GPTQ for LLaMAGPTQ: Initialization\n32\n●Reshape weights from the \ninput layer\n●Initialize Hessian matrixGPTQ: Hessian Matrix Update\n33●Update Hessian matrix with \ninformation from a new \nbatch of the input and \noutput pairs GPTQ: Lazy Batch -Update\n34\n●Processes weight matrix W in blocks.', '-Q even work for extreme 2 -bit quantization? 22Effectiveness of GPTQ?•Calibration data randomly sampled from C -4 dataset to ensure GPTQ is not task -aware. •Standard uniform per -row asymmetric quantization on the \nmin-max grid\n•Quantize on each transformer block (6 layers), with input X \nfrom last quantized block output.', 'methods? •How does GPT -Q’s quantization time scale with model size? •How is GPT -Q’s perf on large models compared with Round -to- nearest methods? •How does GPT -Q speed up model inference in practical \napplications?', '25 How is GPT -Q’s perf on large models compared with Round -to-nearest methods? 26 How does GPT -Q’s quantization time scale with model size? 27* Measured on single A100ZeroQuant -LKD GPT-Q\n1.3B model - 3h\nDoes GPT -Q even work for extreme 2 -bit quantization?']",0.0,0.0,0.0,0,0.06451612903225806,0.25,0.10256410256410256,0.30220266142236174,0.18244406196213425,0.3793103448275862,10,2.503181325537413e-07,0.0,0.0,0.0,0.0
What does “IO-aware” mean in the context of FlashAttention?,single,"In this paper, we argue that a missing principle is making attention algorithms IO-aware [1]—that is, carefully accounting for reads and writes to diﬀerent levels of fast and slow memory (e.g., between fast GPU on-chip SRAM and relatively slow GPU high bandwidth memory, or HBM [ 45], Figure 1 left).",1,7,"['FLASHATTENTION: fast and memory-efficient exact attention with IO- awareness. InProceedings of the 36th International Conference on Neural Informa- tion Processing Systems(New Orleans, LA, USA)(NIPS ’22). Curran Associates\nInc., Red Hook, NY, USA, Article 1189, 16 pages.', 'accommodated within the GPU memory. Compatibility with FlashAttention [ 10].FlashAttention is an attention backend widely used in modern LLM serving system to accelerate attention computation. It avoids writing attention weights\nto HBM through kernel fusion, thus significantly reducing data movement between on-chip memory\nand HBM.', 'Stefano Ermon, Atri Rudra, and Christopher Ré. 2022. Flashattention: Fast and memory-efficient exact attention with io-awareness. Advances in Neural Information Processing Systems 35 (2022), 16344–16359. [24] Jingzhi Fang, Yanyan Shen, Yue Wang, and Lei Chen.', 'FlashAttention ’s correctness, runtime, and memory requirement (proof in Appendix C). Theorem 1. Algorithm 1 returns O=softmax¹QK>ºVwith𝑂¹𝑁2𝑑ºFLOPs and requires 𝑂¹𝑁ºadditional memory beyond inputs and output. 3.2 Analysis: IO Complexity of FlashAttention\nWe analyze the IO complexity of FlashAttention , showing signiﬁcant reduction in HBM accesses compared\nto standard attention.', 'Ré. Flashattention: Fast and memory-efficient exact attention with io-awareness. In Sanmi Koyejo, S. Mo- hamed, A. Agarwal, Danielle Belgrave, K. Cho, and A. Oh (eds. ), Advances in Neural\nInformation Processing Systems 35: Annual Conference on Neural Information Process-\ning Systems 2022, NeurIPS 2022, New Orleans, LA, USA, November 28 - December 9,\n2022 , 2022.', 'programmer: Asset or liability? Journal of Systems and Software 203 (2023), 111734. [23] Tri Dao, Dan Fu, Stefano Ermon, Atri Rudra, and Christopher Ré. 2022. Flashattention: Fast and memory-efficient\nexact attention with io-awareness.', 'Fu, S. Ermon, A. Rudra, and C. R ´e, “Flashattention: Fast and memory-efficient exact attention with io-awareness,” Advances in Neural Information Processing Systems , vol. 35, pp. 16 344–16 359,\n2022.15\n[14] W. Kwon, Z. Li, S. Zhuang, Y .', 'abs/2307.08691, 2023. [16] Tri Dao, Daniel Y . Fu, Stefano Ermon, Atri Rudra, and Christopher Ré. Flashattention: Fast and memory- efficient exact attention with io-awareness. In NeurIPS ,\n2022.', 'on the reducing the total memory footprint (maximum amount of GPU memory required) while FlashAttention focuses on reducing memory accesses (the number of memory reads/writes). As mentioned in Section 2, the amount of memory access is the\nprimary determining factor of runtime.', 'Software 203 (2023), 111734. [23] Tri Dao, Dan Fu, Stefano Ermon, Atri Rudra, and Christopher Ré. 2022. Flashattention: Fast and memory-efficient exact attention with io-awareness. Advances in Neural Information Processing Systems 35 (2022), 16344–16359.']",0.0,0.0,0.0,0,0.0,0.0,0.0,0.2561671436828894,0.22127659574468084,0.29381443298969073,10,1.7628544065748924e-07,0.0,0.0,0.0,0.0
"What is internal covariate shift, and how does it affect training?",single,"We deﬁne Internal Covariate Shift as the change in the distribution of network activations due to the change in network parameters during training. To improve the training, we seek to reduce the internal covariate shift. By ﬁxing the distribution of the layer inputs xas the training progresses,we expect to improve the training speed.",1,1,"['ImageNetclassiﬁcation.2 Towards Reducing Internal CovariateShift We deﬁne Internal Covariate Shift as the change in the distribution of network activations due to the change in networkparametersduringtraining. Toimprovethetrain-\ning, we seek to reduce the internal covariate shift.', 'refer to the change in the distributions of internal nodes of a deep network, in the course of training, as In- ternal Covariate Shift . Eliminating it offers a promise of\nfaster training.', '(Shimodaira, 2000). This is typically handled via domain adaptation (Jiang, 2008). However, the notion of covariate shift can be extended beyond the learningsystemasawhole,toapplytoitsparts,suchasa sub-networkora layer. Considera networkcomputing\nℓ=F2(F1(u,Θ1),Θ2)\nwhereF1andF2are arbitrary transformations, and the\nparameters Θ1,Θ2are to be learned so as to minimize\nthe lossℓ.', 'internal nodes of a deep network, in the course of training, as In- ternal Covariate Shift . Eliminating it offers a promise of faster training. We propose a new mechanism, which we\ncallBatch Normalization , that takes a step towards re-\nducing internal covariate shift, and in doing so dramati-\ncally accelerates the training of deep neural nets.', 'inputs remains more stable as the network trains, then the optimizer would be less likely to get stuck in the saturated regime, and the trainingwouldaccelerate. We refer to the change in the distributions of internal\nnodes of a deep network, in the course of training, as In-\nternal Covariate Shift .', 'as the change in the distribution of network activations due to the change in networkparametersduringtraining. Toimprovethetrain- ing, we seek to reduce the internal covariate shift. By\nﬁxingthe distributionof the layer inputs xas the training\nprogresses,weexpecttoimprovethetrainingspeed.', 'to the change in networkparametersduringtraining. Toimprovethetrain- ing, we seek to reduce the internal covariate shift. By ﬁxingthe distributionof the layer inputs xas the training progresses,weexpecttoimprovethetrainingspeed. Ithas\nbeen long known (LeCunetal., 1998b; Wiesler &Ney,\n2011) that the network training convergesfaster if its in-\nputsarewhitened–i.e.,linearlytransformedtohavezero\nmeansandunitvariances,anddecorrelated.', 'Improving predictive inference under covariate shift by weighting the log-likelihood function. JournalofStatisticalPlanningandInference , 90(2):227–244,October2000. Srivastava, Nitish, Hinton, Geoffrey, Krizhevsky, Alex, Sutskever, Ilya, and Salakhutdinov, Ruslan. Dropout:\nA simple way to preventneural networksfrom overﬁt-\nting.J.', 'experiments,we foundthis effect to be advantageous to the generalization of the network. Whereas Dropout (Srivastavaet al., 2014) is typically used to reduce over- ﬁtting,inabatch-normalizednetworkwefoundthatitcan beeitherremovedorreducedinstrength. 4 Experiments\n4.1 Activationsovertime\nTo verify the effects of internal covariate shift on train-\ning, and the ability of Batch Normalization to combat it,\nweconsideredtheproblemofpredictingthedigitclasson\ntheMNISTdataset(LeCunetal.,1998a).', 'to continu- ously adapt to the new distribution. When the input dis- tributiontoalearningsystemchanges,itissaidtoexperi- encecovariateshift (Shimodaira, 2000). This is typically handled via domain adaptation (Jiang, 2008). However,\nthe notion of covariate shift can be extended beyond the\nlearningsystemasawhole,toapplytoitsparts,suchasa\nsub-networkora layer.']",1.0,0.5,0.6666666666666666,1,0.3548387096774194,0.6666666666666666,0.46315789473684216,0.4314166314509495,0.15877437325905291,0.9930795847750865,10,0.07983061371329453,1.0,1.0,0.6666666666666666,1.0
What is NVIDIA GPU Confidential Computing (CC) and how does it secure communication?,single,"NVIDIA CC ensures the confidentiality and integrity of communication between a CVM and a GPU via AES-GCM encryption [ 15]. A critical component of AES- GCM is the Initialization Vector (IV), a unique, non-repeating number (a nonce) required for each encryption session.",1,1,"['hardware GPU confidential computing. A closer look at NVIDIA CC. Although CVMs encrypt their memory, this encryption is separate from that used by NVIDIA CC. NVIDIA CC ensures the confidentiality and\nintegrity of communication between a CVM and a GPU via\nAES-GCM encryption [ 15].', 'Hard- ware GPU confidential computing has low performance over- head and is backward-compatible with existing applications. This paper focuses on studying hardware GPU confidential computing. A closer look at NVIDIA CC.', 'insecure GPU commands, but this adds substantial performance overhead due to extra runtime checks for indirect memory access, heavily used in systems like vLLM [25]. Unlike software-based solutions, NVIDIA Confidential\nComputing relies on hardware: NVIDIA H100 GPU is the\nfirst commercial implementation with confidential comput-\ning capability [ 15].', 'low performance over- head and is backward-compatible with existing applications. This paper focuses on studying hardware GPU confidential computing. A closer look at NVIDIA CC. Although CVMs encrypt\ntheir memory, this encryption is separate from that used\nby NVIDIA CC.', 'of this is the NVIDIA H100 GPU [ 36], which supports confidential computing inside the GPU to protect sensitive data and models from unauthorized access. Moreover, the data communication between the CVM\nand the GPU enclave is encrypted, further reinforcing the\nsecurity of I/O operations.', '[25]. Unlike software-based solutions, NVIDIA Confidential Computing relies on hardware: NVIDIA H100 GPU is the first commercial implementation with confidential comput- ing capability [ 15]. Working with CVMs, H100 could build a\nGPU enclave, allowing users to have exclusive control over\nthe GPU and rejecting any access from the host, such as\n= AES(keyCPU, IV=1,       ) aCPU\nGPUEncrypt\nDecryptDecrypt\nEncrypt= AES(keyCPU, IV=2,       ) b\n= AES(keyGPU, IV=5,       )\n= AES(keyGPU, IV=6,       ) dab\nab\ncdcd\ncCVM shared memory\nIV = 3\nIV = 7Figure 1: Workflow of encrypted data transfer in NVIDIA\nCC.', 'respectively. read/write GPU memory and modify the control flow. Hard- ware GPU confidential computing has low performance over- head and is backward-compatible with existing applications. This paper focuses on studying hardware GPU confidential\ncomputing.', 'and encryption [27]. Confidential Computing (CC) on GPUs. Beyond CPU- based CVMs, confidential computing on GPUs secures GPU computations such as LLM serving and training. Soter [40],\ndesigned for edge computing, uses CPU-side confidential\ncomputing to eliminate the trust on GPU hardware.', 'is an illustra- tion of how NVIDIA Confidential Computing and PipeLLM execute it. CPU GPU GPUCPUDecrypt Encrypt Saved Time1c 3c 1t1c 1t PipeLLMNVIDIA CC# 1. Swap\xa0 from GPU\n# - PCIe transfer\n# - CPU decryption\ndata = swap_from_gpu()\n# 2.', 'transfers of the NVIDIA CC. Consider the process of copying memory from the CPU to the GPU; the reverse process follows a simi- lar pattern. All CPU-side application data resides in the\nCVM’s private encrypted memory.']",1.0,0.2,0.33333333333333337,1,0.0625,0.5,0.1111111111111111,0.2757501407808912,0.15916955017301038,0.4357142857142857,10,0.044785085320257136,1.0,1.0,0.3333333333333333,1.0
What is the difference between torch.disttibuted and torch.distributed.pipelining?,multi,"('While promising for scaling, pipelining is often difficult to implement because it needs to partition the execution of a model in addition to model weights. The partitioning of execution often requires intrusive code changes to your model. Another aspect of complexity comes from scheduling micro-batches in a distributed environment, with data flow dependency considered.', 'The torch.distributed  package provides PyTorch support and communication primitives for multiprocess parallelism across several computation nodes running on one or more machines.')",2,1,"['has_loss_and_backward , loss_spec ) torch.distributed.pipelining. pipe_split ( ) pipe_split is a special operator that is used to mark the boundary between stages in a module. It is used to split the module into stages.', '2025 torch.distributed.pipelining is currently in alpha state and under development. API changes may be possible. It was migrated from the PiPPy project. Why Pipeline Parallel? Pipeline Parallelism is one of the primitive parallelism for deep learning.', 'Pipeline Parallelism\nCreated On: Jun 16, 2025 | Last Updated On: Jun 16, 2025\ntorch.distributed.pipelining  is currently in alpha state and under development. API\nchanges may be possible. It was migrated from the PiPPy project. Why Pipeline Parallel?', 'splitting the module. (default: None) Return type: A pipeline representation of class Pipe. class torch.distributed.pipelining. Pipe (split_gm , num_stages , has_loss_and_backward , loss_spec ) torch.distributed.pipelining. pipe_split ( )\npipe_split is a special operator that is used to mark the boundary between stages in a module.', 'a commonality that the computation per device cannot hide the communication of conventional parallelism, for example, the weight all-gather of FSDP. What is torch.distributed.pipelining ? While promising for scaling, pipelining is often difficult to implement because it needs to partition\nthe execution of a model in addition to model weights.', 'used by this stage group (Optional[dist.ProcessGroup]) – the process group to be used by this stage Returns: a pipeline stage that can run with PipelineSchedules. Return type:\n_PipelineStage\nPipeline Schedules\nclass torch.distributed.pipelining.schedules.', 'a certain submodule in the forward function. torch.distributed.pipelining. pipeline (module, mb_args, mb_kwargs =None, split_spec =None, split_policy =None ) Split a module based on a specification. See Pipe for more details.', 'stages per rank. Uses the backward for weights to fill in the pipeline bubble. In particular this is implementing the ZB1P schedule in the paper. class\ntorch.distributed.pipelining.schedules.', 'The above scenarios share a commonality that the computation per device cannot hide the communication of conventional parallelism, for example, the weight all-gather of FSDP. What is torch.distributed.pipelining ?', 'certain submodule in the forward function. :ivar END: Represents adding a split point after the execution of a certain submodule in the forward function. torch.distributed.pipelining. pipeline (module, mb_args, mb_kwargs =None,\nsplit_spec =None, split_policy =None )\nSplit a module based on a specification.']",0.5,0.3,0.37499999999999994,1,0.16666666666666666,0.5,0.25,0.32455958071630964,0.2012012012012012,0.45348837209302323,10,0.07882878311156755,0.0,0.0,0.0,0.0
What optimizations does FlashAttention introduce compared to standard attention kernels implemented in PyTorch?,multi,"('FMHA targets BERT models, it only supports head dimension 64, and only runs on A100 GPUs. FMHA fuses the attention computation dropout¹softmax¹mask¹QK>ºººVinto one CUDA kernel. In the forward pass, it stores the attention matrix softmax¹mask¹QK𝑇ººto HBM to be used in gradient computation. As a result, it does not oﬀer substantial memory saving (though for shorter sequences memory footprint is often not a primary concern).', 'This module contains functions and classes that alter the behavior of torch.nn.functional.scaled_dot_product_attention', 'flex_attention This module implements the user facing API for flex_attention in PyTorch. bias Defines bias subclasses that work with scaled_dot_product_attention')",3,1,"['implementation and experimental setting in Tay et al. [80]and Xiong et al. [90].3Table 3 shows that FlashAt- tention achieves up 2.4\x02speed-up compared to standard attention. Block-sparse FlashAttention is\nfaster than all of the approximate attention methods that we have tested.', 'forward + backward pass of FlashAt- tention and block-sparse FlashAttention compared to the baselines in exact, approximate, and sparse attention (exact numbers in Appendix E). Runtime grows quadratically with sequence length, but FlashAt-\ntention runs signiﬁcantly faster than exact attention baselines, up to 3 \x02faster than the PyTorch\nimplementation.', 'that FlashAt- tention achieves up 2.4\x02speed-up compared to standard attention. Block-sparse FlashAttention is faster than all of the approximate attention methods that we have tested. Table 3: The performance of standard attention, FlashAttention , block-sparse FlashAttention , and approximate\nattention baselines on the Long-Range-Arena benchmarks.', 'arrows), loading them to SRAM, and writing the output of the attention computation back to HBM. Right:Speedup over the PyTorch implementation of attention on GPT-2. FlashAttention does not read and write the large 𝑁\x02𝑁attention matrix to HBM, resulting in an 7.6 \x02\nspeedup on the attention computation.', 'E). Runtime grows quadratically with sequence length, but FlashAt- tention runs signiﬁcantly faster than exact attention baselines, up to 3 \x02faster than the PyTorch implementation. The runtimes of many approximate/sparse attention mechanisms grow linearly with se-\nquence length, but FlashAttention still runs faster than approximate and sparse attention for short\nsequences due to fewer memory accesses.', 'Attention. FlashAttention is up to 3\x02faster than the standard attention implemen- tation across common sequence lengths from 128 to 2K and scales up to 64K. Up to sequence length of 512,\nFlashAttention is both faster and more memory-eﬃcient than any existing attention method, whereas\nfor sequence length beyond 1K, some approximate attention methods (e.g., Linformer) start to become\nfaster.', '4], and more [ 40,85]. However, common Python interfaces to deep learning such as PyTorch and Tensorﬂow do not allow ﬁne-grained control of memory access. We propose FlashAttention , a new attention algorithm that computes exact attention with far fewer\nmemory accesses.', 'show that FlashAttention can serve as a useful primitive for realizing the potential of approximate attention algorithms by overcoming their issues with memory access overhead. As a proof of\nconcept, we implement block-sparse FlashAttention , a sparse attention algorithm that is 2-4 \x02faster than\nevenFlashAttention , scaling up to sequence length of 64k.', 'On the other hand, block-sparse FlashAttention is faster than all implementations of exact, sparse, and approximate attention that we know of, across all sequence lengths. Memory Footprint.', 'of FlashAttention and block-sparse FlashAttention compared to prior attention implementations. •Faster Model Training. FlashAttention trains Transformer models faster in wall-clock time. We train BERT-large (seq. length 512) 15% faster than the training speed record in MLPerf 1.1 [ 58], GPT2\n(seq.']",0.0,0.0,0.0,0,0.06666666666666667,0.2857142857142857,0.10810810810810811,0.34082091191293007,0.27040816326530615,0.43386243386243384,10,4.9240727178564545e-05,0.0,0.0,0.0,0.0
